{
  "schema": "rhei.accounting.invocation.v1",
  "invocation_id": "github-issues-vjovanov-ephor-14-fix-issue.ticket.review-1::review::codex-high-openai-gpt-5.6-sol::visit-1",
  "task_id": "github-issues-vjovanov-ephor-14-fix-issue.ticket.review-1",
  "state": "review",
  "visit": 1,
  "target_slug": "codex-high-openai-gpt-5.6-sol",
  "agent": "codex",
  "provider": "openai",
  "model": "gpt-5.6-sol",
  "started_at": "2026-09-01T05:07:40Z",
  "ended_at": "2026-09-01T05:07:58Z",
  "extraction_status": "no-usage-emitted",
  "scope": "aggregate-agent-process",
  "tokens": {
    "total": {
      "status": "unknown"
    },
    "input": {
      "total": {
        "status": "unknown"
      },
      "cached_read": {
        "status": "unsupported"
      },
      "cache_write": {
        "status": "unsupported"
      }
    },
    "output": {
      "total": {
        "status": "unknown"
      },
      "cached_read": {
        "status": "unsupported"
      },
      "cache_write": {
        "status": "unsupported"
      }
    }
  },
  "pricing": {
    "status": "not-applicable"
  }
}