{
  "schema": "rhei.accounting.invocation.v1",
  "invocation_id": "github-issues-vjovanov-fissile-55-fix-issue.ticket::supervising::codex-xhigh-openai-gpt-5.6-sol::visit-2",
  "task_id": "github-issues-vjovanov-fissile-55-fix-issue.ticket",
  "state": "supervising",
  "visit": 2,
  "target_slug": "codex-xhigh-openai-gpt-5.6-sol",
  "agent": "codex",
  "provider": "openai",
  "model": "gpt-5.6-sol",
  "started_at": "2026-09-04T00:13:59Z",
  "ended_at": "2026-09-04T00:14:48Z",
  "duration_ms": 49156,
  "cli_session": {
    "id": "01a069c3-e096-72b1-a42f-68b00ea7597f"
  },
  "extraction_status": "measured",
  "scope": "aggregate-agent-process",
  "tokens": {
    "total": {
      "value": 117685,
      "source": "agent-usage-capture"
    },
    "input": {
      "total": {
        "value": 115497,
        "source": "agent-usage-capture"
      },
      "cached_read": {
        "value": 94208,
        "source": "agent-usage-capture"
      },
      "cache_write": {
        "value": 0,
        "source": "agent-usage-capture"
      }
    },
    "output": {
      "total": {
        "value": 2188,
        "source": "agent-usage-capture"
      },
      "cached_read": {
        "status": "unsupported"
      },
      "cache_write": {
        "status": "unsupported"
      }
    }
  },
  "pricing": {
    "status": "priced",
    "currency": "USD",
    "amount_micro": 543431,
    "priced_amount_micro": 543431,
    "price_book_id": "foundation-site-2026-09-02"
  }
}